lcd_id,text
37873,"Topical Oxygen Therapy Background
After examining the evidence, the Centers for Medicare &amp; Medicaid Services (CMS) responded to a reconsideration request to remove the coverage exclusion of continuous diffusion of oxygen therapy (CDO) from the National Coverage Determination (NCD) Manual and decided that no NCD was appropriate concerning the use of topical oxygen for the treatment of chronic wounds. CMS amended NCD 20.29 by removing Section C. In their decision, CMS allowed coverage of topical application of oxygen for the treatment of chronic wounds to be determined by the local contractors and Medicare coverage of topical oxygen.
Definitions and Scope
This is a non-coverage local coverage determination (LCD)&nbsp;for topical oxygen therapy (TOT). TOT administered to the open wound in small limb-encasing devices is not typically hyperbaric oxygen (HBO) therapy, and its efficacy has not been established due to the lack of controlled clinical trials. In addition, in vitro evidence suggests that TOT does not increase tissue oxygen tension beyond the superficial dermis. Examples of TOT devices are TOPOX portable HBO extremity and sacral chambers (Jersey City, NJ), Oxyboot&reg; and Oxyhealer&reg;&nbsp;from GWR Medical, L.L.P. (Chadds Ford, PA).
This A/B MAC considers TOT to be a method whereby a local supply of oxygen is applied to a wound (Dissemond, Kroger, Storck, Risse, &amp; Engels, 2015). It is delivered by 1 of 2 techniques (Woo, Coutts, &amp; Sibbbald, 2012). In the first, oxygen may be delivered intermittently through an airtight chamber or soft sided &lsquo;bag&rsquo; that is sealed around a wound present on the trunk or limb of the body. The bag or chamber is filled with 100% oxygen at high flow rates (e.g., 10L /min) from an external source to pressures slightly above atmospheric (e.g., 1.004 &ndash; 1.013 atm abs) and is delivered to the patient on an intermittent dosing schedule (Feldmeier et al., 2005; Howard et al., 2013). In the past, this type of oxygen delivery was known by some as topical HBO therapy, a term that is less commonly used today due to the low pressures delivered (Brimson &amp; Nigam, 2013). Topical oxygen can also be delivered to a wound when applied continuously by a tube supplying pure oxygen at a normobaric pressure and low flow rate (3-12 ml/hour) under an occlusive dressing (Howard et al., 2013). These devices have been variously termed transcutaneous oxygen, transdermal continuous oxygen therapy (TCOT), low flow oxygen, topical continuous oxygen therapy, continuous topical oxygen and CDO (Dissemond, Kroger, Storck, Risse, &amp; Engels, 2015; Howard et al., 2013; Lowell, Nicklas, Weily, Johnson, &amp; Lyons, 2009; Orsted et al., 2012; Woo et al., 2012).
Neither intermittent nor continuous provision of topical oxygen is dependent on the systemic circulation reaching the wound, as is the case with HBO. However, because these systems directly apply oxygen to the wound site, it is thought by some that the oxygen can penetrate directly into the injured area, and therefore, improve healing of cutaneous lesions (Brimson &amp; Nigam, 2013; Howard et al., 2013; Orsted et al., 2012; Woo et al., 2012). Typically, intermittent TOT treatments would be administered 4 to 5 days a week for approximately 90 minutes per session (Howard et al., 2013), though there can be other variations of dosaging noted in the clinical protocols. HBO must be provided in medically supervised environments; however, intermittent TOT may be provided in the home setting by a well-trained patient or caregiver. Though infrequent, side effects of HBO can be significant and include the possibility of pneumothorax, ear and sinus barotrauma, pulmonary edema, worsening of congestive heart failure, seizures and retinal damage (Howard et al., 2013). There are also significant concerns among some in the wound care community regarding TOT administered intermittently. For example, some believe that intermittent TOT may impede arterial or capillary circulation, inhibit angiogenesis, and decrease collagen synthesis and fibroblast proliferation; all circumstances which would delay or inhibit healing of a wound (Mutluoglu, Cakkalkurt, Uzun, &amp; Aktas, 2015). TOT may not be appropriate for wounds covered in eschar or those that are deep and penetrating. Moreover, when used on open, exposed wound surfaces, TOT may cause desiccation of the area (Howard et al., 2013). TOT has been proposed in the treatment of skin ulcerations resulting from diabetes, venous stasis, post-surgical infections, gangrenous lesions, pressure ulcers/decubitus ulcers, infected residual limbs, skin grafts, burns and frostbite.
The goal of topical continuous oxygen therapy is to provide an uninterrupted and continuous supply of oxygen to a moist wound. The dressing is designed such that the oxygen is supplied in a manner that most closely approximates the normal diffusion of oxygen in moist tissues, yet a rate sufficient to fuel the increased oxygen demands required in healing tissues. With this therapy, the dressing helps provide an environment for optimal wound healing while managing wound exudate levels, protecting against wound dehydration and protecting against external contamination. Contraindications to this wound therapy includes wounds with inadequate perfusion to support healing; ulcers due to acute thrombophlebitis; ulcers due to Raynaud&rsquo;s disease; necrotic wounds covered with eschar or slough; wounds with fistulae or deep sinus tracts with unknown depth.
The following are Federal Drug Administration (FDA)-approved TOT devices:

EPIFLO&reg; TCOT (Ogenix&reg;) consists of a small, silent, disposable, oxygen concentrator and a long sterile cannula (tube). It is used with any fully occlusive sterile wound dressing to continuously blanket the wound with near 100% oxygen. The patient is free to ambulate and can continue with normal daily living activities while being treated 24 hours per day. EPIFLO&reg; can be worn near the wound beneath clothing without impairing its operation. EPIFLO&reg; extracts oxygen from the air, concentrates it to near 100%, and &ldquo;pumps&rdquo; the oxygen through the cannula to blanket the wound. The wound is covered with a fully occlusive dressing of the provider&rsquo;s choice. The dressing does not inflate and the patient has no sensation of air movement. EPIFLO&reg; provides a silent, continuous, slow flow of oxygen (3 ml/hr for 15 days) that will not dry out the wound. 
TransCu O2&reg; wound care device or EO2 system (EO2 Concepts&reg;) is a portable oxygen delivery system that provides a continuous flow of oxygen to a wound. Through a dressing attached to the device, oxygen is provided directly to the wound for 24 hours per day, 7 days a week. Oxygen is an important part in the wound healing process. The EO2 system employs a TransCu O2&reg; device, which uses fuel cell technology to continuously generate pure humidified oxygen at adjustable flow rates from 3-15 ml/hr and delivers it directly to the wound bed environment within the OxySpur&reg; dressing. The OxySpur&reg; Oxygen Diffusion Dressing is an all-in-one dressing for medium to high exudating wounds. Its design allows distribution of oxygen over the entire wound.
O2Boot&reg; and O2Sacral&reg; (GWR Medical, Inc) are portable and 1-time use devices applied and secured to the body by a hypo-allergenic adhesive seal. The area surrounding the wound receives 100% oxygen at 1.03 atm for 90 min for 4 consecutive days, followed by 3 days without treatment. The weekly treatment regimen is self-administered in the patient&rsquo;s home and continued as directed by the healthcare provider.
 "
37887,"MolDX: Envisia, Veracyte, Idiopathic Pulmonary Fibrosis Diagnostic Test This is a laboratory test which will assist physicians caring for patients who have developed pulmonary (lung) scarring.
This policy provides limited coverage for the Envisia&trade; Genomic Classifier (Veracyte&trade;, Inc., South San Francisco, CA), a tissue based multi-analyte assay with algorithm analysis test (hereafter called Envisia&trade;) for interstitial lung disease (ILD) patients who are suspected of having idiopathic pulmonary fibrosis (IPF) and who do not have a definitive usual interstitial pneumonia (UIP) pattern by high resolution computed tomography (HRCT) or other known cause of ILD. IPF suspicion increases significantly in patients greater than 60 years of age when HRCT is not definitive, and comorbidities in this population make clinicians reluctant to perform surgical lung biopsy to obtain a diagnosis due to significant procedure morbidity and mortality. Envisia&trade; testing is performed on less-invasive bronchoscopy transbronchial biopsy (TBB) samples and is intended to provide a categorical UIP or non-UIP result that along with clinical and radiographic information may guide treatment without the need or risk of surgical lung biopsy.
&nbsp; "
37893,"Endovenous Stenting Compliance with the provisions in this policy may be monitored and addressed through post payment data analysis and subsequent medical review audits.History/Background and/or General InformationChronic venous disease (CVD) is prevalent in the United States of America (USA) affecting more than 6 million adults.1 CVD may be defined as any morphological and functional abnormality of the venous system of long duration manifested either by symptoms and/or signs indicating the need for investigation and/or care.2 Symptoms of progression may include leg heaviness, aching, fatigue, edema, and ulceration.A common feature in chronic venous disease is the formation of progressive venous hypertension in which inflammatory and pro-thrombotic mechanisms are triggered. While the pathophysiology of venous disease is largely related to stasis and reflux, the sequelae of same may ultimately lead to subsequent obstruction resulting in the partial or total occlusion of a vein.Venous thrombosis is the formation of a blood clot in any segment of the deep or superficial venous system. Venous obstruction is considered to be a partial or complete blockage of venous flow in any venous segment. The blockage may be a result of an internal thrombosis or external compression of a vein.Deep Venous Thrombosis (DVT) refers to the formation of blood clots in at least one deep vein, usually of the lower or upper extremities. The Centers for Disease Control and Prevention (CDC) estimates 20-50% of people who experience DVT develop long-term complications.3 Post-thrombotic syndrome (PTS), manifesting itself with a myriad of symptoms, is recognized as the most common long-term complication of DVT.After DVT is objectively diagnosed, clinical tools used to help define PTS may include the Villalta scale, Ginsberg measure or the Brandjes scale. Other tools developed for general chronic venous disease include the Clinical, Etiological, Anatomic, Pathophysiological (CEAP) classification, Venous Clinical Severity Score (VCSS) and the Widmer scale.4Venous stenosis is an abnormal narrowing in a vein. Venous stenosis most commonly affects the axillary, brachial, cephalic, or brachiocephalic veins of the upper extremities, or the superior vena cava, but can also affect the central veins in the abdomen and the pulmonary artery and veins. Common causes are extrinsic compression, thrombosis from various etiologies including, but not limited to, trauma and stenosis from placement of central venous catheters, pacemaker leads or hemodialysis catheters.Noninvasive conservative management of venous disease and stenosis includes treatment that improves venous circulation and reduces lower extremity edema (e.g., elevation, analgesics, diuretics, weight management, exercise, tobacco cessation or compression and anticoagulant therapy) to prevent thromboembolic complications.Failed conservative management of clinically significant symptomatic venous stenosis may include angioplasty and placement of an endovenous stent. An endovenous stent may be defined as a synthetic tubular structure implanted in native or graft vasculature to provide mechanical radial support and enhance vessel patency. Percutaneous transluminal angioplasty (PTA) delivers the stent under radiographic guidance to the intended location, where it is expanded within the luminal space using either a balloon catheter or a self-expanding mechanism.In the infancy of stenting, intravascular stents were developed for arterial obstructions to restore and maintain arterial perfusion. Early venous stenting extrapolated these indications from arterial use and applied balloon-expandable and self-expandable stents to veins as an off-label use.As an initial therapeutic intervention, angioplasty may be performed on near-obstructed veins to alleviate symptomatic areas of stenosis. In general, the determination of success for angioplasty is evaluated by using the degree of residual stenosis, the appearance of the vessel wall, and the absence of a complication.5Clinical experience has shown advantages and disadvantages of the different stent types. Compared to the self-expanding type, balloon-expandable stents tend to have higher radial force but will not re-expand if crushed or bent. On the other hand, self-expanding stents, available in larger lengths and diameters, are reported to conform better to curvatures and deploy easily. Venous stent technologies are emerging with many questions still unanswered.6In the search for the optimal endovenous stent, various types, each with their unique characteristics, have been tried in search of the optimal desired outcome.Nitinol stents have also been developed as an adjunct for treatment of venous stenosis.Several different stents are currently used in the medical community.Coverage for placement of endovenous stents depends on the use of a U.S. Food and Drug Administration (FDA) approved stent. Neither FDA classification and marketing indication nor American Medical Association (AMA) Current Procedural Terminology (CPT) category descriptors determine that a product meets Medicare reasonable and necessary requirements. Each device has specific indications described by the FDA for approved market uses. All products with FDA clearance/approval used in accordance with the individualized product application guidelines will be considered for the purpose of this LCD. Stent placement is covered by Medicare only when an FDA-approved stent is used for the FDA-approved indications or for off-label indication(s) supported by the peer reviewed medical literature. For more details please see the FDA website at http://www.fda.gov/.It is the responsibility of the treating physician/practitioner to:

Determine and comply with FDA approval and specific designation for use of any agent or device utilized for the procedure or treatment planned
Comply with all applicable State and Federal regulations, laws and licensure related to the use of the agents and devices utilized

The central focus of this Local Coverage Determination (LCD) will be on the indications for placement of stents in a severely symptomatic patient with a vein which may be partially or near occluded.Covered Indications Failed conservative management of CVD may include the need for Percutaneous Transluminal Angioplasty (PTA). Placement of endovenous stents may be considered as a planned adjunct to suboptimal or failed angioplasty.A suboptimal or failed angioplasty is defined as dilation judged by the physician to be suboptimal or failed due to the presence of unfavorable lesion morphology such as:

Residual stenosis of more than 30 percent for a vein measured at the narrowest point of the vascular lumen at the site of angioplasty or more than 50 percent reduction of luminal diameter.5(p59)
A tear that interrupts the integrity of the intima or lumen causing hemorrhage.
Abrupt persistent occlusion or dissection at the site of angioplasty, occlusion elastic recoil or refractory spasm.

A stent may be placed as a planned adjunct to angioplasty rather than in response to a suboptimal or failed angioplasty.Primary endovenous stenting is justified for situations where angioplasty alone is not expected to provide a durable result.Endovenous stents may be placed for patients with severely symptomatic venous obstructions due to any of the following:

Iliac vein compression syndrome also known as May-Thurner or Cockett syndrome.
Iliocaval obstruction.
Iliofemoral obstruction for patients with venous leg ulceration(s) not relieved by conservative therapies and compression. Progression of symptoms may lead to Phlegmasia Cerulea Dolens (PCD), acute inferior vena cava (IVC) thrombosis, and rapid thrombus extension despite anticoagulation as well as anatomically extensive DVT affecting the common femoral and/or iliac vein, or post-thrombotic stenosis with ankle edema of venous origin (i.e., minimum CEAP score 3).
Superior or Inferior Vena Caval Thrombosis including Superior Vena Cava syndrome.
Post-thrombotic syndrome (PTS).
As an adjunct to catheter-directed thrombolysis for acute femoroiliocaval deep vein thrombosis when post thrombolysis imaging identifies symptomatic residual stenosis.
Post radiation venous stenosis.
Symptomatic post-traumatic venous stenosis including those resulting from central venous catheters or transvenous device (e.g., pacemakers, defibrillators,) pacemaker leads or a history of abdominal and/or pelvic surgery.
Salvage of thrombosed or stenotic symptomatic or limited function arteriovenous dialysis access fistulae or grafts with compromised venous outflow, failed angioplasty rapid restenosis, or vessel perforation. This may include treatment of trapping a life threatening thrombus, an aneurysm or pseudoaneurysm that threatens the viability of the AV fistula or graft, or the treatment of a hemodialysis vascular access rupture that cannot be controlled through balloon tamponade.
Thrombotic obstruction of major hepatic veins (Budd-Chiari syndrome).
Transvenous decompression of portosystemic shunts.
Post-operative stenosis or venous narrowing due to repair of congenital cardiac disease, e.g. sinus venosus Atrial Septal Defect (ASD), discordant atrioventricular connection status post Mustard or Senning repair of Transposition of the Great Arteries (TGA).
Pulmonary vein stenosis resulting from congenital malformation, extrinsic compression, sequelae of radiofrequency ablation (RFA), lung transplantation, or status post repair of Total Anomalous Pulmonary Vein Return (TAPVR).

 
Limitations The following are considered not medically reasonable and necessary:

All other uses of endovenous stents not listed as a covered indication in this LCD.
The placement of a stent in a vein for which there is no objective-related symptom or limitation of function is considered to be preventive and, therefore, not covered by Medicare.
Presence of local or systemic infection is a relative contraindication to venous stenting except under unusual circumstances where the benefit of placing the stent may outweigh the risks. In these circumstances, the documentation should reflect the provider's rationale.
Use of stents without U.S. FDA approval.
Stenting of popliteal or tibial veins.
Venous stenosis less than or equal to 50% of diameter of vein or residual stenosis of less than 30% measured after angioplasty.
Venous stenting for idiopathic intracranial hypertension (IIH) is considered investigational and may be considered only in select isolated and unique circumstances upon individual redetermination.
A stent(s) that carries an Investigational Device Exemption (IDE) may be covered under Medicare. Medicare coverage of IDE devices is predicated, in part, upon their status with the FDA. Coverage will cease in the event a manufacturer loses (or violates relevant IDE requirements necessitating FDA&rsquo;s withdrawal of) IDE approval. The FDA issues a special identifier number that corresponds to each device or stent(s) granted an IDE.

Provider QualificationsServices will be considered reasonable and necessary only if performed by appropriately trained physicians.

Physicians who perform endovenous stent procedures must possess the knowledge, skills, training and experience necessary to properly select suitable patients who will benefit from and not be harmed by stent therapy as opposed to other intervention, perform the procedures safely, and recognize and handle complications of stent placement. Physicians who perform and report these services for Medicare payment must have satisfied training and competency guidelines in peripheral vascular medicine and intervention as part of a formal postgraduate training program in radiology, nephrology, cardiology or general/vascular surgery. Alternatively, physicians must have completed supervised training in vascular medicine and intervention as published by a recognized specialty organization of the same stature as the American College of Radiology, American College of Cardiology or American College of Surgery, or American Society of Diagnostic and Interventional Nephrology.
For those physicians who would not have had formal training, i.e. before 2000, Medicare expects that any physician who seeks and receives payment for these services is prepared to substantiate his/her training and experience if asked to do so by Medicare. Substantiation of the training may include ongoing CME and Training events, Medical Staff privileges in order to do the procedures, or attestation by peers.

A qualified physician for this service/procedure is defined as:

Physician (MD or DO) properly enrolled in Medicare, Licensed by the State with full scope of practice, with


Training and experience acquired through tenured practice or within the framework of an accredited residency and/or fellowship training program in the applicable specialty/subspecialty in the United States, reflecting equivalent education, training and expertise endorsed by an academic institution or specialty society in the United States.

Notice: Services performed for any given diagnosis must meet all of the indications and limitations stated in this policy, the general requirements for medical necessity as stated in CMS payment policy manuals, any and all existing CMS national coverage determinations, and all Medicare payment rules.The redetermination process may be utilized for consideration of services performed outside of the reasonable and necessary requirements in this LCD. "
37897,"MolDX: Inivata, InVisionFirst®, Liquid Biopsy for Patients with Lung Cancer This test is a &#8220;liquid biopsy"". It is intended to assist physicians caring for patients who suffer from a common form of lung cancer and who have advanced disease.
This policy provides limited coverage for InvisionFirst&#174; - Lung (Inivata&#8482;, Research Triangle Park, NC) (hereafter InVision&#174;) a plasma-based, somatic comprehensive genomic profiling (CGP) test for patients with advanced (Stage IIIB/IV) non-small cell lung cancer (NSCLC):

At diagnosis

When results for EGFR single nucleotide variants (SNVs) and insertions and deletions (indels); rearrangements in ALK and ROS1; and SNVs for BRAF are not available AND when tissue-based CGP is infeasible [i.e., quantity not sufficient (QNS) for tissue-based CGP or invasive biopsy is medically contraindicated],



or

At progression

For patients progressing on or after chemotherapy or immunotherapy who have not been tested for EGFR SNVs and indels; rearrangements in ALK and ROS1; and SNVs for BRAFs, and for whom tissue-based CGP is infeasible; or
For patients progressing on EGFR tyrosine kinase inhibitors (TKIs).



If no genetic alteration is detected by InVision&#174; or if circulating tumor DNA (ctDNA) is insufficient/not detected, tissue-based genotyping should be considered. "
37903,"MolDX: Inivata, InVisionFirst®, Liquid Biopsy for Patients with Lung Cancer This test is a &ldquo;liquid biopsy"". It is intended to assist physicians caring for patients who suffer from a common form of lung cancer and who have advanced disease.
This policy provides limited coverage for InvisionFirst&reg; - Lung (Inivata&trade;, Research Triangle Park, NC) (hereafter InVision&reg;) a plasma-based, somatic comprehensive genomic profiling (CGP) test for patients with advanced (Stage IIIB/IV) non-small cell lung cancer (NSCLC):

At diagnosis

When results for EGFR single nucleotide variants (SNVs) and insertions and deletions (indels); rearrangements in ALK and ROS1; and SNVs for BRAF are not available AND when tissue-based CGP is infeasible [i.e., quantity not sufficient (QNS) for tissue-based CGP or invasive biopsy is medically contraindicated],



or

At progression

For patients progressing on or after chemotherapy or immunotherapy who have not been tested for EGFR SNVs and indels; rearrangements in ALK and ROS1; and SNVs for BRAFs, and for whom tissue-based CGP is infeasible; or
For patients progressing on EGFR tyrosine kinase inhibitors (TKIs).



If no genetic alteration is detected by InVision&reg; or if circulating tumor DNA (ctDNA) is insufficient/not detected, tissue-based genotyping should be considered. "
