lcd_id,text
39383,"Sacroiliac Joint Injections and Procedures Compliance with the provisions in this LCD may be monitored and addressed through post payment data analysis and subsequent medical review audits.
&nbsp;
History/Background and/or General Information
 
Low back pain (LBP) is highly prevalent in the Medicare population with reports of 50 to 84% of adults experiencing back pain at some point and is the highest cause of disability globally. Approximately 15% to 30% of patients with persistent mechanical LBP below L5 have pain arising from their sacroiliac joints (SIJ). SIJ dysfunction is common after spinal fusion; and reported in up to 40% in some studies.1 The SIJ is a complex structure; it is a diarthrodial joint with matching articulate surfaces between the sacrum and ilium separated by synovial fluid and surrounded by a fibrous capsule. It is only a true synovial joint in the anterior portion, due to discontinuity of the posterior capsule. It serves as the biomechanical mediator between the spine and the pelvis. The joint is responsible for flexion and extension of the sacrum with counterrotation of the ileum and there is only a small amount of movement. The complexity of the joint is in the small degree of movement of the joint and the functional supporting structures of the joint (mainly the muscles, fascia and ligamentous connections).
The sacroiliac (SI) joint goes through many changes throughout life. In early childhood, the surfaces of the joint are smooth and allow gliding motions in many directions. After puberty, the surface of the ilium becomes rougher and coated with fibrous plaques that will restrict motion significantly. These age-related changes will increase in the third and fourth decade and by the sixth decade motion may become noticeably restricted. By the eighth decade, plaque will form and erosions will be present.2 The SI joint has variable joint capacity as the SI joint degenerates with age and has varied from 0.5-2.5 ml.
&nbsp;
The exact pattern of innervation of the joint is unclear, but the subchondral bone, capsule and surrounding ligaments are innervated by spinal nerves with nociceptor and proprioceptors and therefore can be a source of pain from the SIJ complex may arise from the posterior extraarticular elements that are innervated by the lateral branches of S1-S3 and L5 dorsal ramus or the anterior complex innervated by spinal nerves, branches of the gluteal and obturator nerves and lumbosacral trunks known as the intra-articular elements.1 The spectrum of pain and dysfunction from SIJ pain is variable but can be debilitating.
In addition to conservative and surgical modalities, interventional procedures are used for treatment of SIJ pain. This includes SIJ injections and radiofrequency (RFA) ablation of the SIJ joint. Injections typically are intra-articular and contain anesthetic and corticosteroids. Ablation relies on radiofrequency-generated thermal energy to ablate the sensory nerve fibers of the sacroiliac joint, thereby interrupting nociceptive signals.
The treatment of individuals with spinal disorders, including pain, can be complex, and it is recommended that all individuals being considered for interventional spinal procedures undergo a thorough evaluation and be treated following development of a comprehensive care plan.
&nbsp;
Covered Indications
A. Sacroiliac joint injections (SIJI) will be considered medically reasonable and necessary when all the following requirements are met:



Moderate to severe low back pain primarily experienced over the anatomical location of the SI joints between the upper level of the iliac crests and the gluteal fold, AND
Low back pain duration of at least three (3) months, AND
Low back pain below L5 without radiculopathy, AND
Clinical findings and/or imaging studies do not suggest any other diagnosed or obvious cause of the lumbosacral pain (such as central spinal stenosis with neurogenic claudication/myelopathy, foraminal stenosis or disc herniation with concordant radicular pain/radiculopathy, infection, tumor, fracture, pseudoarthrosis, or pain related to spinal instrumentation), AND
At least three positive findings with provocative maneuvers: FABER, Gaenslen, Thigh Thrust or Posterior Shear, SI Compression, SI Distraction and Yeoman Tests,3,4 AND
Low back pain persists despite a minimum of four weeks of conservative therapies.5



B. Diagnostic Sacroiliac Joint Injections
&nbsp; &nbsp; &nbsp; &nbsp; &nbsp; Diagnostic SIJI is used to determine if the etiology of pain is from the sacroiliac joint complex.3
&nbsp; &nbsp; &nbsp; &nbsp; &nbsp; Diagnostic SIJI are considered reasonable and necessary for patients who meet ALL the following criteria:



The patient must meet the above criteria for Covered Indications for SIJI, AND
The SI joint injections must be performed under CT or fluoroscopy image guidance with contrast, except ultrasound guidance may be considered reasonable and necessary when there is a documented contrast allergy or pregnancy, since the accuracy with ultrasound guidance is inferior to fluoroscopic guidance,6 AND
SI joint injection are not performed with other musculoskeletal injections in the lumbosacral spine, AND
The documentation should show direct causal benefit from the SI joint injection and not from other musculoskeletal injections or treatments, AND
The diagnostic SIJI provided a minimum of 75% relief of primary (index) pain with the diagnostic SIJI (a positive diagnostic response is defined as &ge;75% sustained and constant pain relief for the duration of the local anesthetic and &ge;75% sustained and constant pain relief for the duration of the anti-inflammatory steroid) was measured by the SAME pain scale* at baseline. The measurements of pain must be taken pre-injection on the day of the SIJ injection, post-intervention on the day of the injection, and the days following the injection to substantiate and corroborate the pain scores consistent with the pain relief for the duration of the local anesthetic and/or steroid used.



&nbsp;
Limitation:  No more than two (2) diagnostic joint sessions, unilateral or bilateral. To clarify, two unilateral sessions, if performed on one side at one session and on the opposite side at a different session, would meet the limitation of two (2) diagnostic sessions.
&nbsp;
C. Therapeutic SIJI:
Therapeutic SIJI will be considered medically reasonable and necessary for patients who meet ALL the following criteria:

The patient must meet the above criteria of Covered Indications for SIJI, AND
The diagnostic SIJI provided a minimum of 75% relief of primary (index) pain with the diagnostic SIJI (a positive diagnostic response is defined as &ge;75% sustained and constant pain relief for the duration of the local anesthetic and &ge;75% sustained and constant pain relief for the duration of the anti-inflammatory steroid) was measured by the SAME pain scale* at baseline. The measurements of pain were taken pre-injection on the day of the diagnostic SIJ injection, post-intervention on the day of the diagnostic injection, and the days following the diagnostic SIJ injection to substantiate and corroborate consistent pain relief for the duration of the local anesthetic and/or steroid used, AND
Subsequent therapeutic SIJI are considered medically reasonable and necessary when the subsequent SIJI are provided at the same anatomic site as therapeutic SIJI, AND the therapeutic SIJI produced at least consistent 50% pain relief or at least 50% consistent improvement in the ability to perform previously painful movements and activities of daily living (ADLs) for at least three (3) months from the proximate therapeutic SIJI procedure and compared to baseline measurements for ADLS and painful movements or pain relief using the same pain scale* AND
The SI joint injections must be performed under CT or fluoroscopy image guidance with contrast, except ultrasound guidance may be considered reasonable and necessary when there is a documented contrast allergy or pregnancy, since the accuracy with ultrasound guidance is inferior to fluoroscopic guidance.6

Limitations: No more than four (4) therapeutic SIJI sessions, unilateral or bilateral, will be reimbursed per rolling 12 months. To clarify, a therapeutic SIJI session if performed on one side first and then on the opposite side at a different session would qualify as two (2) sessions for the limitation of four (4) therapeutic SIJ sessions per rolling 12 months.
&nbsp;
D. SIJ Denervation (also called Radiofrequency Ablation or RFA) is not considered reasonable and necessary. 
 
*Note: The scales used to measure of pain and/or disability must be documented in the medical record. Acceptable scales include but are not limited to: verbal rating scales, Numerical Rating Scale (NRS) and Visual Analog Scale (VAS) for pain assessment, and Pain Disability Assessment Scale (PDAS), Oswestry Disability Index (ODI), Oswestry Low Back Pain Disability Questionnaire (OSW), Quebec Back Pain Disability Scale (QUE), Roland Morris Pain Scale, Back Pain Functional Scale (BPFS), and the PROMIS profile domains to assess function.
&nbsp;
E. Requirements

The SIJI must be performed under CT or fluoroscopy image guidance with contrast, unless the patient has a documented contrast allergy or pregnancy where ultrasound guidance without contrast may be considered.6
The SIJ procedure(s) should be performed in conjunction with conservative treatments.7
Patient should be part of an ongoing, and be actively participating in a rehabilitation program, home exercise program or functional restoration program.8,9
SIJ primary index pain must be measured prior to the injection at the beginning of the session.
The post procedure pain level must be measured after the SIJ injection at the conclusion of the session.
SIJI may be performed unilateral or bilateral if clinically indicated within the same session.
The documentation must have the radiographic films (i.e. fluoroscopy images) of the procedure in at least two (2) views (i.e., the pre and post contrast injection views in the AP and oblique planes) to confirm intraarticular injection of contrast and the treatment agent(s) used.
When documenting the percentage of pain relief from the primary (index) pain compared to the post-injection pain levels, it is insufficient to report only a percentage of pain relief and/or a nonspecific statement of the duration of pain relief. The documentation should include a specific assessment of the duration of relief being consistent or inconsistent with the agent used for the injection and the specific dates the measurements were obtained using the SAME pain scale* used at baseline.
When documenting the ability to perform previously painful movements and activities of daily living (ADLs) it is insufficient to provide a vague or nonspecific statement regarding the improvement of previously painful movements and activities of daily living (ADLs). The documentation should include a functional assessment to show clinically meaningful improvement with painful movements and ADLs, if this metric is used to justify the efficacy of the SIJI procedure. Providers should use established and measurable goals and objective scales to assess functionality and ADLs measures.

&nbsp;
Limitations

Injections performed without radiographic image guidance are not considered reasonable and necessary.6
A SIJI involves the use of an anesthetic, corticosteroid, and contrast agent and does not include injections of biologics (e.g., platelet rich plasma, stem cells, amniotic fluid, etc.) and/or any other injectates.
It is not considered medically reasonable and necessary to perform multiple blocks (ESI, sympathetic blocks, facet blocks, trigger point injections, etc.) during the same session as SIJs injections and during the post-SJI injection efficacy assessment period.
Use of Moderate or Deep Sedation, General Anesthesia, and Monitored Anesthesia Care (MAC) is usually unnecessary or rarely indicated for SIJ injections and therefore not considered medically reasonable and necessary.10 Even in patients with a needle phobia and anxiety, typically oral anxiolytics suffice.9
SIJIs to treat non-specific low back pain (LBP), axial spine pain primary above the level of L5, complex regional pain syndrome, widespread diffuse pain, chronic pain syndrome, and pain from neuropathy are considered investigational and therefore are not considered medically reasonable and necessary.
SIJIs used as part of a series of lumbar spine and musculoskeletal injections to treat nonspecific or chronic low back pain is not considered reasonable and necessary.
In patients with implanted electrical devices, (i.e., spinal cord stimulation, peripheral nerve stimulation, cardiac devices, etc.) and intrathecal pump delivery devices, providers should follow manufacturer instructions and extra planning as indicated to ensure safety of the procedure.
Patients with coexisting psychological conditions or depression related illness should be treated and stabilized prior to proceeding with interventional procedures.11 Multidisciplinary biopsychosocial rehabilitation principles should be provided to these patients.


It generally would not be considered medically reasonable and necessary for treatment with SIJIs to extend beyond 12 months. Frequent continuation of SIJIs injections over 12 months may trigger a focused medical review. Use beyond twelve month requires the following:

Pain is severe enough to cause a significant degree of functional disability or vocational disability and providers use established and measurable goals and objective scales to assess functionality and ADLs measures.
SIJIs provides at least 50% sustained and consistent improvement of pain and/or 50% sustained and consistent objective improvement in function (using same scale as baseline) for at least three (3) months.
Rationale for the continuation of SIJIs including but not limited to patient who are high-risk surgical candidates, the patient does not desire surgery, and/or the recurrence of pain in the same location was sustained and consistently relieved with the SIJIs for at least three (3) months.
The primary care provider should be notified regarding continuation of procedures and prolonged repeat steroid use to allow for systematic care delivery treatment surveillance and multidisciplinary biopsychosocial rehabilitation (MBR).


A subsequent diagnostic SIJI is not reasonable and necessary when the initial diagnostic block does not produce a positive response of &ge; 75% pain reduction.
A subsequent therapeutic SIJI is not reasonable and necessary when the proximate SIJI did not provide at least a consistent 50% pain relief or at least a 50% consistent improvement in the ability to perform previously painful movements and activities of daily living (ADLs) for at least three (3) months compared to baseline objective measurements for ADLS and painful movements or pain relief using the same pain scale*

Provider Qualifications
The Medicare Program Integrity Manual states services will be considered medically reasonable and necessary only if performed by appropriately trained providers.
Patient safety and quality of care mandate that healthcare professionals who perform SIJ injections/procedures for chronic pain (not surgical anesthesia) are appropriately trained and/or credentialed by a formal residency/fellowship program and/or are certified by either an accredited and nationally recognized organization or by a post-graduate training course accredited by an established national accrediting body or accredited professional training program whose core curriculum includes the performance and management of the procedures addressed in this policy. Credentialing or privileges are required for procedures performed in inpatient and outpatient settings.12
All aspects of care must be within the provider&rsquo;s medical licensure and scope of practice. Reimbursement for procedures utilizing imaging techniques may be made to providers who meet training requirements for the procedures in this policy only if their respective state allows such in their practice act and formally licenses or certifies the practitioner to use and interpret these imaging modalities (ionizing radiation and associated contrast material, magnetic resonance imaging, ultrasound). At a minimum, training must cover and develop an understanding of anatomy and drug pharmacodynamics and kinetics as well as proficiency in diagnosis and management of disease, the technical performance of the procedure, and utilization of the required associated imaging modalities.
Notice: Services performed for any given diagnosis must meet all the indications and limitations stated in this LCD, the general requirements for medical necessity as stated in CMS payment policy manuals, all existing CMS national coverage determinations, and all Medicare payment rules.
 
&nbsp;
&nbsp; "
39385,Near-Infrared Spectroscopy in Wound and Flap Management This is a NON-coverage policy for non-contact near-infrared spectroscopy use in acute or chronic wound assessment and management and for use in flap or micro-flap assessment intra- or post-operatively.  
39387,"Luteinizing Hormone-Releasing Hormone (LHRH) Analogs Luteinizing Hormone-Releasing Hormone (LHRH) Analogs are synthetic analogs of the naturally occurring gonadotropin releasing hormone (GnRH) with greater potency than the naturally occurring hormone, that when given inhibits pituitary gonadotropin secretion and suppresses testicular and ovarian steroidogenesis.
 
Leuprolide acetate (Lupron Depot&reg;), goserelin acetate (Zoladex&reg;), triptorelin pamoate (Trelstar&reg;), histrelin acetate (Vantas&reg;) are synthetic LHRH agonists, analogs of the naturally occurring GnRH, and leuprolide mesylate (Camcevi&reg;). They will be covered for Food and Drug Administration (FDA) approved indications. The dose and frequency of administration should be consistent with the FDA approved labeling.
 
 
 
 
 
Covered Indications
Leuprolide Acetate is covered for endometriosis, uterine fibroids, advanced prostate cancer, head and neck cancer (salivary gland tumors), ovarian cancer/fallopian tube cancer/primary peritoneal cancer, premenopausal breast cancer, male breast cancer, central precocious puberty (CPP) and palliative treatment of advanced prostate cancer.1 Leuprolide mesylate is covered for advanced prostate cancer.12 The National Comprehensive Cancer Network&reg; (NCCN) Clinical Practice Guidelines in Oncology for Breast Cancer&reg;14, the NCCN Clinical Practice Guidelines in Oncology for Head and Neck Cancers&reg;15, the NCCN Clinical Practice Guidelines in Oncology for Ovarian Cancer&reg;16, and the NCCN Clinical Practice Guidelines in Oncology for Prostate Cancer&reg;17 are referenced for recommendations for coverage across each of these disease settings.
Goserelin implant is covered for locally confined prostate cancer in combination with flutamide; for stage T2b-T4 (stage B2-C) flutamide is recommended only with radiation in this disease setting. Goserelin implant is covered for advanced breast cancer in premenopausal and perimenopausal women, endometriosis, to thin the endometrial lining of the uterus prior to endometrial ablation for dysfunctional uterine bleeding, and palliative treatment of advanced prostate cancer.2 The NCCN Clinical Practice Guidelines in Oncology for Breast Cancer&reg;&nbsp;is cited to nationally recognized guidelines to accommodate specific clinical scenarios.14 The NCCN Clinical Practice Guidelines in Oncology for Prostate Cancer&reg; is cited to nationally recognized guidelines to accommodate specific clinical scenarios for &ldquo;advanced prostate cancer.&rdquo;17
 
Triptorelin pamoate is covered for palliative treatment of advanced prostate cancer.3 The NCCN Clinical Practice Guidelines in Oncology for Prostate Cancer&reg; is cited to nationally recognized guidelines to accommodate specific clinical scenarios for &ldquo;advanced prostate cancer.&rdquo;17
 
Histrelin acetate implant is covered for CPP.
 
 
Note: The NCCN Clinical Practice Guidelines in Oncology for Prostate Cancer&reg; is cited to nationally recognized guidelines to accommodate specific clinical scenarios for &ldquo;advanced prostate cancer.&rdquo;17
Limitations
Services that are not reasonable and necessary cannot be covered by Medicare in the following:
 

The dose and frequency of administration is not consistent with the FDA approved labeling. Doses and frequencies that exceed the FDA recommended dosage/frequency as per the prescribing information, are considered not reasonable and necessary and not covered by Medicare.
 It is contraindicated to administer these products if you have experienced any type of allergic reaction to these drugs or to any of its ingredients.
 "
39389,"MolDX: Molecular Assays for the Diagnosis of Cutaneous Melanoma The purpose of this test is to assist dermatopathologists to arrive at the correct diagnosis of melanoma versus non-melanoma when examining skin biopsies.
 
This Medicare contractor will provide limited coverage for molecular Deoxyribonucleic acid (DNA)/Ribonucleic acid (RNA) assays that aid in the diagnosis or exclusion of melanoma from a biopsy when ALL of the following clinical conditions are met:
 

 The test is ordered by a board-certified or board-eligible dermatopathologist 
 The specimen is a primary (non-metastatic, non-re-excision specimen) cutaneous melanocytic neoplasm for which the diagnosis is equivocal/uncertain (i.e., clear distinction between benign or malignant cannot be achieved using clinical and/or histopathological features alone) despite the performance of standard-of-care test procedures and relevant ancillary tests (i.e., immunohistochemical stains) 
 The specimen includes an area representative of the lesion or portion of the lesion that is suspicious for malignancy
 The patient may be subjected to additional intervention, such as re-excision and/or sentinel lymph node biopsy, as a result of the diagnostic uncertainty
 The patient has not been tested with the same or similar assay for the same clinical indication
 The test is validated for use in the intended-use population and is performed according to its stated intended-use 
 The test demonstrates Analytical and Clinical Validity (AV and CV) and Clinical Utility (CU) and undergoes a technical assessment (TA) by MolDx&reg;to demonstrate compliance of the service with this policy

Tests that demonstrate similar indicated uses and equivalent or superior performance to covered tests may similarly be covered under this policy. "
39391,"Vitamin D Assay Testing This Local Coverage Determination (LCD) identifies the indications and limitations of Medicare coverage and reimbursement for Vitamin D laboratory assays in the medical management of patients.
For Medicare beneficiaries, screening tests are governed by statute. Reimbursement is not allowed for routine screening for vitamin D deficiency in asymptomatic individuals and/or during general encounters.
Although it is not the active form of the hormone, 25-OH vitamin D is much more commonly measured because it better reflects the sum total of vitamin D produced endogenously and absorbed from the diet than does the level of the active hormone 1,25-dihydroxy vitamin. 25-hydroxyvitamin D [25(OH)D] testing will be considered medically reasonable and necessary for individuals at risk for deficiency with the following conditions:

Chronic kidney disease (CKD) stage III or greater
 Cystic Fibrosis (CF)
 Cirrhosis
 Crohn&rsquo;s disease
 Gastric bypass/bariatric surgery
Granuloma forming diseases
 Hyperalimentation
 Hypocalcemia
 Hypercalcemia
 Hypercalciuria
 Hypervitaminosis D
 Hypovitaminosis D
 Inflammatory bowel disease
 Long term use of medications known to lower vitamin d levels: anticonvulsants, antiretroviral therapy, glucocorticoids, antifungals, and cholestyramine
 Parathyroid disorders
 Paget&rsquo;s disease of bone
 Obesity, if Body Mass Index (BMI) &ge; 30 kg/m2
 Obstructive jaundice
 Osteomalacia
 Osteopenia
 Osteoporosis
 Osteosclerosis/petrosis
 Pregnant and lactating women
 Radiation enteritis
 Rickets
 Vitamin D deficiency on replacement therapy related to a condition listed above, to monitor the efficacy of treatment

Deficiency of 1,25-dihydroxy vitamin D, which is present at much lower concentrations, does not necessarily reflect deficiency of 25-OH vitamin D and its measurement should be limited to specific clinical situations. It will be considered reasonable and necessary for patients with the following conditions:

Unexplained hypercalcemia 
 Unexplained hypercalciuria
 Suspected genetic childhood rickets
 Suspected tumor induced osteomalacia
 Nephrolithiasis 
Renal osteodystrophy
Sarcoidosis

Once a beneficiary has been shown to be vitamin D deficient with a serum level of &lt;30 ng/ml, a repeat test after 12 weeks of supplementation will be considered reasonable and necessary to ensure adequate replacement has been accomplished. The medical record must reflect that the beneficiary has been compliant with supplementation. A serum level of &ge;30 ng/ml will be considered evidence of adequate replacement, and no further testing is necessary.
 
If, after a 12-week period of supplementation and documentation of compliance with the prescribed supplementation, the serum level is still &lt;30 ng/ml 1 additional repeat testing within a rolling 12-month period of the initial test, may be performed.
Thereafter, annual testing may be appropriate depending upon the indication and other mitigating factors. The documentation must support the need for annual testing. Annual testing should be rare. "
