lcd_id,text
38229,"Gastrointestinal Pathogen (GIP) Panels Utilizing Multiplex Nucleic Acid Amplification Techniques (NAATs) Compliance with the provisions in this LCD may be monitored and addressed through post payment data analysis and subsequent medical review audits.For many gastrointestinal infections, particularly noninflammatory diarrhea and acute gastroenteritis of short duration, no laboratory testing is recommended.1 In the past, diagnostic testing for these pathogens was accomplished by techniques such as stool culture or examination for ova and parasites. Multiplex nucleic acid-based assays are now available to detect a number of these pathogens in a single stool sample, with results available in a much shorter timeframe. Diagnostic tests may be medically reasonable and necessary according to Medicare when they affect patient management to improve health outcomes. This LCD provides limited coverage for outpatient testing of GIP panels utilizing multiplex nucleic acid amplification techniques (NAATs) for specific conditions. This LCD does not address coverage in the inpatient setting.History/Background and/or General InformationThe Centers for Disease Control estimates that illness potentially transmitted through food causes roughly one in six Americans (or 48 million people) to become sick, 128,000 people to be hospitalized, and 3,000 deaths each year.2 Infectious diarrhea may be due to a variety of pathogens including bacteria, parasites, and viruses.2-5 Conventional diagnostic testing for these pathogens includes techniques such as stool culture or examination for ova and parasites. Historically, treatment decisions were based on symptoms or conventional diagnostic test results. More recently, multiplex nucleic acid-based assays have been introduced to detect a number of pathogens in a single sample, and most require less time than conventional testing methods.1,6-8Recent development of commercial, panel-based, molecular diagnostics for the rapid detection of certain pathogens has resulted in a shift in clinical microbiology and clinical practice.6 These panel-based assays offer less time for sample preparation, rapid turnaround time, and detection of a large number of microorganisms. The tests present challenges including definition of ideal test utilization strategies (e.g., optimal ordering) and test interpretation. Clinicians may not be familiar with all organisms and/or resistant genes that are detected, which may lead to inappropriate treatment and unnecessary subsequent laboratory testing. The design of the multiplex platforms, including those marketed as closed systems, carries a risk of contamination which may be difficult to recognize.6 Studies demonstrate that, compared to conventional methods, the use of multiplex panels increase the positivity rates of GI pathogens by two to four fold.9 Thus, another challenge is with the broad use of multiplex GIP panels, how will healthcare providers use and interpret the large amount of data made available.9The literature supports that the use of GIP panels for the detection of specific pathogens associated with gastrointestinal disease may be important in certain patient populations, such as immunocompromised hosts, the critically ill, or individuals with prolonged disease that is refractory to treatment.1,8,10Diarrhea:One of the most commonly reported illnesses in the United States is acute diarrhea. For the purposes of this LCD, acute diarrhea is defined as lasting less than 14 days, persistent diarrhea is defined as lasting between 14 and 30 days, and chronic diarrhea is defined as lasting longer than 30 days.5 Severe illness is defined as total disability due to diarrhea, moderate illness is defined as the ability to function but with forced change in activities, and mild illness is defined as no change in activities. The best specimen is a diarrheal stool sample which is characterized as a sample that will take the shape of the container.1,10 Clostridium difficile (C. difficile):The diagnosis of C. difficile infection is based on a combination of laboratory and clinical findings including: (a) the presence of diarrhea or evidence of megacolon or severe ileus, and (b) either a positive laboratory test result or evidence of pseudomembranes on endoscopy or histopathology. C. difficile is the most commonly recognized cause of infectious diarrhea in healthcare settings. Advanced age and duration of hospitalization are two of the most important risk factors for C. difficile infections. The most important modifiable risk factor is exposure to antibiotics.11C. difficile is a spore-forming, anaerobic, gram-positive bacillus that is picked up from the environment or via the fecal-oral route. The presence of C. difficile Toxins A and B are responsible for gastrointestinal disease.12 Toxin or nucleic acid amplification testing for C. difficile should only be done on diarrheal stool, not formed stools, unless the physician notes that the patient has an ileus.1Travelers&rsquo; diarrhea (TD):Gastrointestinal problems remain the first complaint among travelers with health problems.13 TD is defined as a gastrointestinal infection resulting in loose, watery stools that occur during travel or within ten days of returning from travel to resource-limited countries or regions. TD can be classified as functional impact: mild, moderate or severe based on the number of loose stools that are passed in 24 hours. The overall impact of TD is substantial although declining due to awareness and improvements of global health, sanitation and hygiene.14Unless treatment is indicated, diagnostic testing is not recommended in most cases of uncomplicated TD.10 Travelers with diarrhea lasting 14 days or longer should be evaluated for intestinal parasitic infections (strength of recommendation: strong, quality of evidence: moderate).10 In addition, the guidelines from the Infectious Disease Society of America&nbsp;recommend that gastrointestinal tract disease including inflammatory bowel disease and postinfectious irritable bowel syndrome (IBS) should be considered during evaluation.10 Testing for C. difficile should be performed in travelers treated with antimicrobial agent(s) within the preceding eight to 12 weeks.10The Guidelines for the prevention and treatment of travelers&rsquo; diarrhea: a graded expert panel report,14 also support microbiologic testing in returning travelers with severe or persistent symptoms (diarrhea lasting two weeks or longer) or in those who fail empiric therapy. The authors also state that molecular testing, aimed at a broad range of clinically relevant pathogens, is preferred when rapid results are necessary for a direct medical treatment decision, or when non-molecular tests available have failed to establish a diagnosis (ungraded).14 The authors noted no studies have been published which show that using molecular testing improves patient outcomes.14 Covered Indications

GIP panels utilizing NAATs, 11 or fewer targets, are medically reasonable and necessary for the evaluation of Medicare beneficiaries with the following:




Acute diarrhea present for at least seven days duration1, 5, 10; or
Persistent diarrhea of 14-30 days1, 5, 10; or
Acute diarrhea with signs or risk factors for severe disease to include any of the following:



fever,
bloody diarrhea,
dysentery,
dehydration,
severe abdominal pain,
hospitalization, or
an immunocompromised state 1, 5, 10








GIP panels utilizing NAATs, 12 or more targets, are medically reasonable and necessary for the evaluation of Medicare beneficiaries with the following:




An immunocompromising medical condition with acute or persistent diarrhea.1,9,10



LimitationsGIP panels utilizing multiplex NAATs are considered not medically reasonable and necessary for any of the following:
 

Using a single NAAT or multiplex NAAT to test for clearance of the pathogen (i.e., &ldquo;test of cure&rdquo;).1, 11
Testing of asymptomatic patients.1,6,10,11,15
Repeat testing utilizing the same or a different GIP panel within seven days during the same episode of diarrhea by the same or different provider.1,11
 Performance of more than one GIP panel on the same date of service by the same or different provider.

 
It is expected that GIP panels utilizing multiplex NAATs for the evaluation of chronic diarrhea (e.g., infectious) would be rare,5, 10 and may be considered for coverage on redetermination.Provider QualificationsLaboratory services must meet all applicable requirements of the Clinical Laboratory Improvement Amendments of 1988 (CLIA), as set forth at 42 CFR part 493. Please see CMS IOM, Publication 100-02, Medicare Benefit Policy Manual, Chapter 15, Section 80.1 &ndash; Laboratory services, for provider applicable requirements.Notice: Services performed for any given diagnosis must meet all of the indications and limitations stated in this LCD, the general requirements for medical necessity as stated in CMS payment policy manuals, any and all existing CMS national coverage determinations, and all Medicare payment rules. "
38231,"Endovenous Stenting Compliance with the provisions in this policy may be monitored and addressed through post payment data analysis and subsequent medical review audits.History/Background and/or General InformationChronic venous disease (CVD) is prevalent in the United States of America (USA) affecting more than 6 million adults.1 CVD may be defined as any morphological and functional abnormality of the venous system of long duration manifested either by symptoms and/or signs indicating the need for investigation and/or care.2 Symptoms of progression may include leg heaviness, aching, fatigue, edema, and ulceration.A common feature in chronic venous disease is the formation of progressive venous hypertension in which inflammatory and pro-thrombotic mechanisms are triggered. While the pathophysiology of venous disease is largely related to stasis and reflux, the sequelae of same may ultimately lead to subsequent obstruction resulting in the partial or total occlusion of a vein.Venous thrombosis is the formation of a blood clot in any segment of the deep or superficial venous system. Venous obstruction is considered to be a partial or complete blockage of venous flow in any venous segment. The blockage may be a result of an internal thrombosis or external compression of a vein.Deep Venous Thrombosis (DVT) refers to the formation of blood clots in at least one deep vein, usually of the lower or upper extremities. The Centers for Disease Control and Prevention (CDC) estimates 20-50% of people who experience DVT develop long-term complications.3 Post-thrombotic syndrome (PTS), manifesting itself with a myriad of symptoms, is recognized as the most common long-term complication of DVT.After DVT is objectively diagnosed, clinical tools used to help define PTS may include the Villalta scale, Ginsberg measure or the Brandjes scale. Other tools developed for general chronic venous disease include the Clinical, Etiological, Anatomic, Pathophysiological (CEAP) classification, Venous Clinical Severity Score (VCSS) and the Widmer scale.4Venous stenosis is an abnormal narrowing in a vein. Venous stenosis most commonly affects the axillary, brachial, cephalic, or brachiocephalic veins of the upper extremities, or the superior vena cava, but can also affect the central veins in the abdomen and the pulmonary artery and veins. Common causes are extrinsic compression, thrombosis from various etiologies including, but not limited to, trauma and stenosis from placement of central venous catheters, pacemaker leads or hemodialysis catheters.Noninvasive conservative management of venous disease and stenosis includes treatment that improves venous circulation and reduces lower extremity edema (e.g., elevation, analgesics, diuretics, weight management, exercise, tobacco cessation or compression and anticoagulant therapy) to prevent thromboembolic complications.Failed conservative management of clinically significant symptomatic venous stenosis may include angioplasty and placement of an endovenous stent. An endovenous stent may be defined as a synthetic tubular structure implanted in native or graft vasculature to provide mechanical radial support and enhance vessel patency. Percutaneous transluminal angioplasty (PTA) delivers the stent under radiographic guidance to the intended location, where it is expanded within the luminal space using either a balloon catheter or a self-expanding mechanism.In the infancy of stenting, intravascular stents were developed for arterial obstructions to restore and maintain arterial perfusion. Early venous stenting extrapolated these indications from arterial use and applied balloon-expandable and self-expandable stents to veins as an off-label use.As an initial therapeutic intervention, angioplasty may be performed on near-obstructed veins to alleviate symptomatic areas of stenosis. In general, the determination of success for angioplasty is evaluated by using the degree of residual stenosis, the appearance of the vessel wall, and the absence of a complication.5Clinical experience has shown advantages and disadvantages of the different stent types. Compared to the self-expanding type, balloon-expandable stents tend to have higher radial force but will not re-expand if crushed or bent. On the other hand, self-expanding stents, available in larger lengths and diameters, are reported to conform better to curvatures and deploy easily. Venous stent technologies are emerging with many questions still unanswered.6In the search for the optimal endovenous stent, various types, each with their unique characteristics, have been tried in search of the optimal desired outcome.Nitinol stents have also been developed as an adjunct for treatment of venous stenosis.Several different stents are currently used in the medical community.Coverage for placement of endovenous stents depends on the use of a U.S.&nbsp;Food and&nbsp;Drug Administration (FDA) approved stent. Neither FDA classification and marketing indication nor American Medical Association (AMA) Current Procedural Terminology (CPT) category descriptors determine that a product meets Medicare reasonable and necessary requirements. Each device has specific indications described by the FDA for approved market uses. All products with FDA clearance/approval used in accordance with the individualized product application guidelines will be considered for the purpose of this LCD. Stent placement is covered by Medicare only when an FDA-approved stent is used for the FDA-approved indications or for off-label indication(s) supported by the peer reviewed medical literature. For more details please see the FDA website at http://www.fda.gov/.It is the responsibility of the treating physician/practitioner to:

Determine and comply with FDA approval and specific designation for use of any agent or device utilized for the procedure or treatment planned
Comply with all applicable State and Federal regulations, laws and licensure related to the use of the agents and devices utilized

The central focus of this Local Coverage Determination (LCD) will be on the indications for placement of stents in a severely symptomatic patient with a vein which may be partially or near occluded.Covered IndicationsFailed conservative management of CVD may include the need for Percutaneous Transluminal Angioplasty (PTA). Placement of endovenous stents may be considered as a planned adjunct to suboptimal or failed angioplasty.A suboptimal or failed angioplasty is defined as dilation judged by the physician to be suboptimal or failed due to the presence of unfavorable lesion morphology such as:

Residual stenosis of more than 30 percent for a vein measured at the narrowest point of the vascular lumen at the site of angioplasty or more than 50 percent reduction of luminal diameter.5(p59)
A tear that interrupts the integrity of the intima or lumen causing hemorrhage
Abrupt persistent occlusion or dissection at the site of angioplasty, occlusion elastic recoil or refractory spasm

A stent may be placed as a planned adjunct to angioplasty rather than in response to a suboptimal or failed angioplasty.Primary endovenous stenting is justified for situations where angioplasty alone is not expected to provide a durable result.Endovenous stents may be placed for patients with severely symptomatic venous obstructions due to any of the following:

Iliac vein compression syndrome also known as May-Thurner or Cockett syndrome
Iliocaval obstruction
Iliofemoral obstruction for patients with venous leg ulceration(s) not relieved by conservative therapies and compression. Progression of symptoms may lead to Phlegmasia Cerulea Dolens (PCD), acute inferior vena cava (IVC) thrombosis, and rapid thrombus extension despite anticoagulation as well as anatomically extensive DVT affecting the common femoral and/or iliac vein, or post-thrombotic stenosis with ankle edema of venous origin (i.e., minimum CEAP score 3).
Superior or Inferior Vena Caval Thrombosis including Superior Vena Cava syndrome
Post-thrombotic syndrome (PTS).
As an adjunct to catheter-directed thrombolysis for acute femoroiliocaval deep vein thrombosis when post thrombolysis imaging identifies symptomatic residual stenosis
Post radiation venous stenosis
Symptomatic post-traumatic venous stenosis including those resulting from central venous catheters or transvenous device (e.g., pacemakers, defibrillators,) pacemaker leads or a history of abdominal and/or pelvic surgery.
Salvage of thrombosed or stenotic symptomatic or limited function arteriovenous dialysis access fistulae or grafts with compromised venous outflow, failed angioplasty rapid restenosis, or vessel perforation. This may include treatment of trapping a life threatening thrombus, an aneurysm or pseudoaneurysm that threatens the viability of the AV fistula or graft, or the treatment of a hemodialysis vascular access rupture that cannot be controlled through balloon tamponade.
Thrombotic obstruction of major hepatic veins (Budd-Chiari syndrome.)
Transvenous decompression of portosystemic shunts
Post-operative stenosis or venous narrowing due to repair of congenital cardiac disease, e.g. sinus venosus Atrial Septal Defect (ASD), discordant atrioventricular connection status post Mustard or Senning repair of Transposition of the Great Arteries (TGA).
Pulmonary vein stenosis resulting from congenital malformation, extrinsic compression, sequelae of radiofrequency ablation (RFA), lung transplantation, or status post repair of Total Anomalous Pulmonary Vein Return (TAPVR).&nbsp;

LimitationsThe following are considered not medically reasonable and necessary:

All other uses of endovenous stents not listed as a covered indication in this LCD.
The placement of a stent in a vein for which there is no objective-related symptom or limitation of function is considered to be preventive and, therefore, not covered by Medicare.
Presence of local or systemic infection is a relative contraindication to venous stenting except under unusual circumstances where the benefit of placing the stent may outweigh the risks. In these circumstances, the documentation should reflect the provider's rationale.
Use of stents without U.S. FDA approval.
Stenting of popliteal or tibial veins.
Venous stenosis less than or equal to 50% of diameter of vein or residual stenosis of less than 30% measured after angioplasty.
Venous stenting for idiopathic intracranial hypertension (IIH) is considered investigational and may be considered only in select isolated and unique circumstances upon individual redetermination.
A stent(s) that carries an Investigational Device Exemption (IDE) may be covered under Medicare. Medicare coverage of IDE devices is predicated, in part, upon their status with the FDA. Coverage will cease in the event a manufacturer loses (or violates relevant IDE requirements necessitating FDA&rsquo;s withdrawal of) IDE approval. The FDA issues a special identifier number that corresponds to each device or stent(s) granted an IDE.

Provider QualificationsServices will be considered reasonable and necessary only if performed by appropriately trained physicians.

Physicians who perform endovenous stent procedures must possess the knowledge, skills, training and experience necessary to properly select suitable patients who will benefit from and not be harmed by stent therapy as opposed to other intervention, perform the procedures safely, and recognize and handle complications of stent placement.&nbsp; Physicians who perform and report these services for Medicare payment must have satisfied training and competency guidelines in peripheral vascular medicine and intervention as part of a formal postgraduate training program in radiology, nephrology, cardiology or general/vascular surgery. Alternatively, physicians must have completed supervised training in vascular medicine and intervention as published by a recognized specialty organization of the same stature as the American College of Radiology, American College of Cardiology or American College of Surgery, or American Society of Diagnostic and Interventional Nephrology.
For those physicians who would not have had formal training, i.e. before 2000, Medicare expects that any physician who seeks and receives payment for these services is prepared to substantiate his/her training and experience if asked to do so by Medicare. Substantiation of the training may include ongoing CME and Training events, Medical Staff privileges in order to do the procedures, or attestation by peers.

A qualified physician for this service/procedure is defined as:

Physician (MD or DO) properly enrolled in Medicare, Licensed by the State with full scope of practice, with
Training and experience acquired through tenured practice or within the framework of an accredited residency and/or fellowship training program in the applicable specialty/subspecialty in the United States, reflecting equivalent education, training and expertise endorsed by an academic institution or specialty society in the United States.

Notice: Services performed for any given diagnosis must meet all of the indications and limitations stated in this policy, the general requirements for medical necessity as stated in CMS payment policy manuals, any and all existing CMS national coverage determinations, and all Medicare payment rules.&nbsp;The redetermination process may be utilized for consideration of services performed outside of the reasonable and necessary requirements in this LCD. "
