lcd_id,text
38378,"Fluid Jet System in the Treatment of Benign Prostatic Hyperplasia (BPH) Compliance with the provisions in this policy may be monitored and addressed through post payment data analysis and subsequent medical review audits.
History/Background and/or General Information
Benign prostatic hyperplasia (BPH) is a histological diagnosis characterized by an increased number of epithelial and stromal cells in the prostate. It is most common in men over the age of 40, and the incidence increases with age. In the United States, 8 million men greater than 50 years old suffer from BPH. In many cases BPH is asymptomatic, however, symptoms may occur due to prostate enlargement and compression of the urethra leading to bothersome lower urinary tract symptoms (LUTS), including voiding symptoms such as hesitancy, weak stream, straining, prolonged voiding, and storage symptoms (frequency, urgency, and nocturia). LUTS/BPH can have a significant impact on the quality of life and can cause serious complications such as infections, bleeding, calculus formation, urinary retention, and decline of renal function when untreated.1 First line treatment generally consists of treatment with medications such as alpha blockers, PDE5 Inhibitors, or finasteride/dutasteride. If treatment with medications is not successful, surgical options may then be considered. Transurethral resection of the prostate (TURP) and open simple prostatectomy (OSP) are the standard surgical treatments for LUTS/BPH and are highly effective and provide improved outcomes in urinary functions. However, neither TURP nor OSP are without considerable perioperative complication and morbidity.2 Transurethral waterjet ablation is a surgical-based therapy that combines image guidance and robotics to remove prostatic tissue.3 The system works by pumping high pressure saline (500 to 8000 pounds per square inch [PSI]) through a probe nozzle to cut and dissect tissue at predetermined system parameters.3
Covered Indications
Treatment for LUTS/BPH will be considered reasonable and necessary when performed using an FDA approved/cleared device ONCE in patients with the following:

Indications including ALL of the following:

Prostate volume of 30-150 mL.4,5
Persistent moderate to severe symptoms despite maximal medical management including ALL of the following:

International Prostate Symptom Score (IPSS) &ge;12.
Maximum urinary flow rate (Qmax) of &le;15 mL/s.4,5
Failure, contraindication or intolerance to at least three months of conventional medical therapy for LUTS/BPH (e.g., alpha blocker, PDE5 Inhibitor, finasteride/dutasteride)





Limitations
The following are considered not reasonable and necessary:

Body mass index6 &ge; 42kg/m.2
Known or suspected prostate cancer (based on NCCN Prostate Cancer Early Detection guidelines7) or a prostate specific antigen (PSA) &gt;10 ng/mL unless the patient has had a negative prostate biopsy within the last 6 months.8
Bladder cancer, neurogenic bladder, bladder calculus or clinically significant bladder diverticulum.6
Active urinary tract or systemic infection.9
Treatment for chronic prostatitis.6
Diagnosis of urethral stricture, meatal stenosis, or bladder neck contracture.6
Damaged external urinary sphincter.6
Known allergy to device materials.9
Inability to safely stop anticoagulants or antiplatelet agents preoperatively.9

CMS Internet-Only Manual, Pub 100-08, Medicare Program Integrity Manual, Chapter 13, &sect;13.5.4 Reasonable and Necessary Provisions in an LCD states services will be considered reasonable and necessary only if performed by appropriately trained providers.
Patient safety and quality of care mandate that healthcare professionals who perform transurethral waterjet ablation of the prostate are appropriately trained and credentialed by a formal residency/fellowship program. Credentialing or privileges are required for procedures performed in inpatient and outpatient settings.
All aspects of care must be within the provider&rsquo;s medical licensure and scope of practice.
Notice: Services performed for any given diagnosis must meet all the indications and limitations stated in this LCD, the general requirements for medical necessity as stated in CMS payment policy manuals, all existing CMS national coverage determinations, and all Medicare payment rules. "
38385,"Hypoglossal Nerve Stimulation for the Treatment of Obstructive Sleep Apnea Notice: Compliance with the provisions in this policy may be monitored and addressed through post payment data analysis and subsequent medical review audits.History/Background and/or General InformationObstructive sleep apnea (OSA) is a disease characterized by recurrent episodes of upper airway obstruction during sleep. The disruption in airflow caused by OSA has been associated with multiple comorbidities, including hypertension, cardiovascular disease, cardiac arrhythmia, cerebrovascular disease, excessive daytime sleepiness, and mood disorders. Continuous positive airway pressure (CPAP) has long been the primary treatment modality of choice for OSA, showing improvements in many comorbidities. Unfortunately, despite attempts to improve compliance, many people are unable to tolerate treatment with CPAP. Because of the large percentage of patients not tolerating CPAP, alternative treatment strategies are necessary.The hypoglossal nerve is the twelfth cranial nerve, and innervates all the extrinsic and intrinsic muscles of the tongue, except for the palatoglossus which is innervated by the vagus nerve. It is a nerve with a solely motor function. The nerve arises from the hypoglossal nucleus in the brain stem as a number of small rootlets, passes through the hypoglossal canal and down through the neck, and eventually branches within the tongue and innervates the tongue. There are two hypoglossal nerves in the body: one on the left, and one on the right.The concept of stimulating the tongue musculature to increase upper airway size and limit the pathophysiologic obstruction leading to OSA was introduced in the late 1980s. A variety of strategies were utilized, including transcutaneous stimulation with placement of electrodes in the submental region, sublingual mucosa, and soft palate. However, these studies were limited by their lack of selective stimulation of the primary protrusor of the tongue, the genioglossus muscle. In 2001, Schwartz et al performed a trial in which they selectively stimulated the branches of the hypoglossal nerve, innervating the genioglossus. They noted a significant improvement in the apnea-hypopnea index (AHI) and O2 desaturation nadir. This technology was subsequently refined, and in 2014 the Stimulation Therapy for Apnea Reduction (STAR) trial was published as the initial clinical trial using upper airway stimulation (UAS) as an alternative therapy to CPAP for treatment of OSA.The only Food and Drug Administration (FDA) - approved hypoglossal nerve stimulation (HGNS) system has three implantable components: a stimulation lead that delivers mild stimulation to maintain multilevel airway patency during sleep, a breathing sensor lead that senses breathing patterns, and a generator that monitors breathing patterns. The two external components are a patient sleep remote that provides a noninvasive means for a patient to activate the generator and a physician programmer that allows the physician to noninvasively interrogate and configure the generator settings. The system battery life for the implantable components is 7 to 10 years.A surgeon implants the system containing a neurostimulator subcutaneously in the patient&rsquo;s chest, with one lead attached to the patient&rsquo;s hypoglossal nerve (cranial nerve XII) at the base of the tongue and one lead implanted in the patient&rsquo;s chest. The lead in the chest consists of a pressure sensor that detects breathing. Information about respiration rate is relayed to the device, which stimulates the hypoglossal nerve in the tongue. When stimulated, the tongue moves forward, opening the airway. The patient can operate the device by remote control, which the patient activates before going to sleep. The device turns on after 20 minutes to minimize disrupting the patient&rsquo;s sleep onset; the device must be manually turned off via remote when the patient wakes.Covered IndicationsFDA-approved hypoglossal nerve neurostimulation is considered medically reasonable and necessary for the treatment of moderate to severe obstructive sleep apnea when all of the following criteria are met:

Beneficiary is 22 years of age or older; and
Body mass index (BMI) is less than 35 kg/m2; and
A polysomnography (PSG) is performed within 24 months of first consultation for HGNS implant; and
Beneficiary has predominantly obstructive events (defined as central and mixed apneas less than 25% of the total AHI); and
AHI is 15 to 65 events per hour; and
Beneficiary has documentation that demonstrates CPAP failure (defined as AHI greater than 15 despite CPAP usage) or CPAP intolerance (defined as less than 4 hours per night, 5 nights per week or the CPAP has been returned) including shared decision making that the patient was intolerant of CPAP despite consultation with a sleep expert: and
Absence of complete concentric collapse at the soft palate level as seen on a drug-induced sleep endoscopy (DISE) procedure; and
No other anatomical findings that would compromise performance of device (e.g., tonsil size 3 or 4 per standardized tonsillar hypertrophy grading scale).

Limitations
The following are considered not reasonable and necessary and therefore will be denied:

Hypoglossal nerve neurostimulation is considered not medically reasonable and necessary for all other indications.
Non-FDA-approved hypoglossal nerve neurostimulation is considered not medically reasonable and necessary for the treatment of adult obstructive sleep apnea due to insufficient evidence of being safe and effective.
Hypoglossal nerve neurostimulation is considered not medically reasonable and necessary when any of the following contraindications are present:

Beneficiaries with central and mixed apneas that make up more than one-quarter of the total AHI.
Beneficiaries with an implantable device could experience unintended interaction with the HGNS implant system.
BMI equal to or greater than 35.
Neuromuscular disease.
Hypoglossal-nerve palsy.
Severe restrictive or obstructive pulmonary disease.
Moderate-to-severe pulmonary arterial hypertension.
Severe valvular heart disease.
New York Heart Association class III or IV heart failure.
Recent myocardial infarction or severe cardiac arrhythmias (within the past 6 months).
Persistent uncontrolled hypertension despite medication use.
An active, serious mental illness that reduces the ability to carry out Activities of Daily Living (ADLs) and would interfere with the patient&rsquo;s ability to operate the HNS and report problems to the attending provider.
Coexisting nonrespiratory sleep disorders that would confound functional sleep assessment.
Beneficiaries who are, or who plan to become pregnant.
Beneficiaries who require Magnetic Resonance Imaging (MRI) with model 3024.
Beneficiaries,&nbsp; who require MRI with&nbsp; model 3028, can undergo MRI on&nbsp; the head and extremities if certain&nbsp; conditions &nbsp;and precautions are met.&nbsp;&nbsp; Please refer to the Manufacturer Guidelines for this model and future models for more information.
Beneficiaries who are unable or do not have the necessary assistance to operate the sleep remote.
Beneficiaries with any condition or procedure that has compromised neurological control of the upper airway.


Drug Induced Sleep Endoscopy (DISE):

Due to documented inconsistency in determining if complete concentric collapse (CCC) is present, the inserting provider shall be certified by the FDA approved manufacturer&rsquo;s second opinion service of validation via video clip submissions of at least 80% agreement in at least 15 consecutive studies. Inserting providers shall have documentation to submit to this contractor if necessary.


Shared Decision Making (SDM):

SDM, by definition, is any documented conversation between an attending provider and the patient, and not between multiple providers. Providers shall provide these documents if requested by this contractor.



Place of Service (POS)Hypoglossal nerve stimulation for the treatment of OSA must be furnished in accordance with the accepted standards of medical practice in a setting appropriate to the patient&rsquo;s medical needs and condition.Provider QualificationsHypoglossal nerve stimulation for the treatment of OSA must be ordered and furnished by qualified personnel. The hypoglossal nerve (HN) may be damaged during neck surgeries. A detailed understanding of the anatomy of the hypoglossal nerve in relation to various anatomical landmarks and surrounding structures is important to reduce procedural complications and the risk of nerve damage.&nbsp;

Provider Specialties

Insertion of hypoglossal nerve stimulation addressed in this LCD must be performed by a qualified physician (MD or DO) who is a board certified or a board eligible otolaryngologist having completed a residency and/or fellowship program and maintains ongoing certification in otolaryngology.
Insertion of an FDA-approved hypoglossal nerve stimulation device must be performed by a qualified physician who completed the appropriate AMA or AOA certified residency program in otolaryngology. In addition, prior to implanting the system, surgeons will need to receive classroom instruction by an FDA approved device manufacturer or equivalent on device implant techniques as well as cadaver training. Documentation must be provided to support completion of training to an exemplary level by the manufacturer. Sleep physicians and sleep technicians shall receive classroom instruction from a similar facility on how to titrate the device including hands on operation of the program. Doctors must maintain, for the contractor to review, documentation of such training completion to a satisfactory level of completion as established by the device manufacturer or appropriate board approval of competency. Evaluation, referral and post implant evaluation of the hypoglossal nerve stimulator, but not including expected post-op care by the inserting physician, should be performed by board eligible or certified sleep physician with qualifications as outlined in LCD L35050, Outpatient Sleep Studies. In addition, Sleep Technicians shall meet the same qualifications as outlined in the LCD L35050, Outpatient Sleep Studies. Likewise, sleep studies shall be performed in an accredited sleep facility as stated in LCD L35050.



Notice: Services performed for any given diagnosis must meet all of the indications and limitations stated in this policy, the general requirements for medical necessity as stated in CMS payment policy manuals, any and all existing CMS national coverage determinations, and all Medicare payment rules.The redetermination process may be utilized for consideration of services performed outside of the reasonable and necessary requirements in this LCD. "
