lcd_id,text
39082,"Genetic Testing for Cardiovascular Disease Compliance with the provisions in this LCD may be monitored and addressed through post payment data analysis and subsequent medical review audits.
History/Background and/or General Information
With advancement in science and technology comes the ability to incorporate genetic testing for hereditary cardiovascular disease into clinical care, with the goal of improved patient outcomes. The scope of this LCD is genetic testing in the practice of cardiovascular medicine in the Medicare population.
The genetic basis of cardiovascular disease is an area of rapidly expanding knowledge. To date, identification of genetic variants associated with cardiovascular disease includes hypertrophic and dilated cardiomyopathy (associated with mutations in sarcomere and structural genes), arrhythmogenic cardiomyopathy (associated with mutations in desmosome genes), inherited arrhythmias (associated with mutations in transmembrane ion channels genes), and Marfan and related syndromes (associated with mutations in genes encoding connective tissue elements). Association does not necessarily translate to improvement in patient care.
In certain circumstances, genetic testing for inherited cardiovascular disease in patients with the corresponding appropriate phenotypic medical condition could have the potential to assist patient management in the Medicare population. However, given the complexity and rapidly expanding knowledge in this topic area, there is also a potential for testing that does not help the patient or leads to confusion. Specialized clinical expertise in cardiovascular medicine in addition to advanced knowledge in both genetic variation and effect on gene function is required to facilitate optimal outcomes for patients.
Covered Indications
Genetic testing for hereditary cardiovascular disease will be considered medically reasonable and necessary if:

The patient has rigorous disease-appropriate phenotyping to establish clinical diagnosis or suspected diagnosis for which the test results would directly impact the management of the patient&rsquo;s condition, prior to ordering the testAND
The evidence for the gene-disease association is evaluated by the evidence-based, transparent, peer-reviewed process of the National Institutes of Health (NIH) sponsored Clinical Genome Resource (ClinGen) and is determined to demonstrate actionability in clinical decision making, meeting all bulleted metrics:

Disease severity of sudden death, possible death or major morbidity, modest morbidity
Substantial or moderate evidence of a &gt;40% likelihood of disease
Substantial or moderate evidence of a highly effective or moderately effective intervention
The nature of intervention is either low risk/medically acceptable/low intensity intervention or moderately acceptable/risk/intensive interventions,AND


Clinical validity and qualitative descriptors from Moderate, Strong &amp; Definitive with contradictory evidence NOT being reported as disputed or refuted.

Limitations
The following are considered not medically reasonable and necessary:

A genetic test where either analytical validity, clinical validity, or clinical utility has not been established.
Genetic testing in patients who do not demonstrate the disease-appropriate phenotype of the gene-disease association.
Genetic testing of asymptomatic patients.
Genetic testing solely for purposes of proband identification.
Genetic testing with family history as the only indication.
Gene tests for cardiovascular disease are considered germline testing, and therefore only permitted once per beneficiary&rsquo;s lifecycle.

Provider Qualifications
The ordering provider of a genetic test for a patient with a cardiovascular disease-appropriate phenotype:

Must be the treating clinician who is responsible for the cardiovascular disease management of the patient&rsquo;s condition; and,
Understands how the test result will impact the patient&rsquo;s condition; and,
Has presented this information to the patient eliciting patient understanding.

Notice: Services performed for any given diagnosis must meet all of the indications and limitations stated in this LCD, the general requirements for medical necessity as stated in CMS payment policy manuals, any and all existing CMS national coverage determinations, and all Medicare payment rules. "
39084,"Genetic Testing for Cardiovascular Disease Compliance with the provisions in this LCD may be monitored and addressed through post payment data analysis and subsequent medical review audits.
History/Background and/or General Information
With advancement in science and technology comes the ability to incorporate genetic testing for hereditary cardiovascular disease into clinical care, with the goal of improved patient outcomes. The scope of this LCD is genetic testing in the practice of cardiovascular medicine in the Medicare population.
The genetic basis of cardiovascular disease is an area of rapidly expanding knowledge. To date, identification of genetic variants associated with cardiovascular disease includes hypertrophic and dilated cardiomyopathy (associated with mutations in sarcomere and structural genes), arrhythmogenic cardiomyopathy (associated with mutations in desmosome genes), inherited arrhythmias (associated with mutations in transmembrane ion channels genes), and Marfan and related syndromes (associated with mutations in genes encoding connective tissue elements). Association does not necessarily translate to improvement in patient care.
In certain circumstances, genetic testing for inherited cardiovascular disease in patients with the corresponding appropriate phenotypic medical condition could have the potential to assist patient management in the Medicare population. However, given the complexity and rapidly expanding knowledge in this topic area, there is also a potential for testing that does not help the patient or leads to confusion. Specialized clinical expertise in cardiovascular medicine in addition to advanced knowledge in both genetic variation and effect on gene function is required to facilitate optimal outcomes for patients.
Covered Indications
Genetic testing for hereditary cardiovascular disease will be considered medically reasonable and necessary if:

The patient has rigorous disease-appropriate phenotyping to establish clinical diagnosis or suspected diagnosis for which the test results would directly impact the management of the patient&rsquo;s condition, prior to ordering the testAND
The evidence for the gene-disease association is evaluated by the evidence-based, transparent, peer-reviewed process of the National Institutes of Health (NIH) sponsored Clinical Genome Resource (ClinGen) and is determined to demonstrate actionability in clinical decision making, meeting all bulleted metrics:

Disease severity of sudden death, possible death or major morbidity, modest morbidity
Substantial or moderate evidence of a &gt;40% likelihood of disease
Substantial or moderate evidence of a highly effective or moderately effective intervention
The nature of intervention is either low risk/medically acceptable/low intensity intervention or moderately acceptable/risk/intensive interventions,AND


Clinical validity and qualitative descriptors from Moderate, Strong &amp; Definitive with contradictory evidence NOT being reported as disputed or refuted.

Limitations
The following are considered not medically reasonable and necessary:

A genetic test where either analytical validity, clinical validity, or clinical utility has not been established.
Genetic testing in patients who do not demonstrate the disease-appropriate phenotype of the gene-disease association.
Genetic testing of asymptomatic patients.
Genetic testing solely for purposes of proband identification.
Genetic testing with family history as the only indication.
Gene tests for cardiovascular disease are considered germline testing, and therefore only permitted once per beneficiary&rsquo;s lifecycle.

Provider Qualifications
The ordering provider of a genetic test for a patient with a cardiovascular disease-appropriate phenotype:

Must be the treating clinician who is responsible for the cardiovascular disease management of the patient&rsquo;s condition; and,
Understands how the test result will impact the patient&rsquo;s condition; and,
Has presented this information to the patient eliciting patient understanding.

Notice: Services performed for any given diagnosis must meet all of the indications and limitations stated in this LCD, the general requirements for medical necessity as stated in CMS payment policy manuals, any and all existing CMS national coverage determinations, and all Medicare payment rules. "
39086,"Treatment of Males with Low Testosterone Compliance with the provisions in this policy may be monitored and addressed through post payment data analysis and subsequent medical review audits.
Covered Indications
 
Treatment with testosterone is medically reasonable and necessary when prescribed for:

Symptomatic hypogonadism (congenital or acquired) due to a disorder of the testicles, pituitary gland, or brain
Delayed male puberty
Gender dysphoria in a member who is able to make an informed decision to engage in hormone therapy

This A/B MAC expects that the establishment of a diagnosis of primary hypogonadism will be undertaken with at least 2 separate fasting serum testosterone levels, taken on 2 different days, drawn prior to 10 AM, and obtained from identical laboratories. A single luteinizing hormone (LH) or follicle stimulating hormone (FSH) level will also be drawn. Elevated LH/FSH confirms primary hypogonadism and the potential need for replacement hormone. If the 2 testosterone determinations are low AND the LH/FSH level(s) are also low, pituitary disease (including a serum prolactin) or chronic diseases should be assessed. ONLY secondary hypogonadism that is due to a medical disorder of the testicles, pituitary gland, or brain will be considered reasonable and necessary for treatment with testosterone. Prescribing and monitoring parameters will include: 

Prostate-specific antigen (PSA) testing must be done within the last 12 months prior to prescribing testosterone AND there will be ongoing monitoring throughout therapy.
Hematocrit must be evaluated prior to prescribing testosterone AND there will be ongoing monitoring throughout therapy.
Digital prostate exam must be done within the last 12 months prior to prescribing testosterone AND there will be ongoing monitoring throughout therapy. 
Where replacement is indicated, the dose of replacement therapy should be the least amount necessary to obtain a serum testosterone in the low normal range. There will be ongoing monitoring of testosterone levels throughout therapy.
Testosterone replacement can be administered by many routes. The current preferred routes are by transdermal preparations. 
Due to United States (U.S.) Food and Drug Administration (FDA) listed warnings about possible thromboembolic disease, increase in erythrocythemia, cardiovascular risk, and stroke, the clinical records shall reflect that these issues were discussed with the patient before initiating therapy. 
Documentation of the symptoms, signs, physical examination, and required laboratory tests must be available in the chart if requested.

Limitations
 
The following uses of testosterone are considered NOT medically reasonable and necessary:

Patients with hypogonadism due to aging also known as late-onset hypogonadism (LOH)
Idiopathic hypogonadism not due to disorder of the testicles, pituitary gland, or brain
Male menopause
Patients with a breast cancer diagnosis 
Patients with a prostate cancer diagnosis unless previously undergone a radical prostatectomy and disease free for at least 2 years
Patients with thrombophilia or patients who have had a myocardial infarction (MI), cardiac revascularization, or a stroke within the past 6 months
Patients with a prostate nodule or induration, a PSA &gt; 4 ng/mL or &gt; 3 ng/mL in men at increased risk of prostate cancer (e.g., African American men or those who have a first-degree relative with diagnosed prostate cancer)
Patients with a hematocrit &gt; 48% 
Patients interested in reproduction

Notice: Services performed for any given diagnosis must meet all of the indications and limitations stated in this policy, the general requirements for medical necessity as stated in CMS payment policy manuals, any and all existing CMS National Coverage Determinations (NCDs), and all Medicare payment rules.
 
The redetermination process may be utilized for consideration of services performed outside of the reasonable and necessary requirements in this Local Coverage Determination (LCD). "
39116,"Amniotic and Placental-Derived Product Injections and/or Applications for Musculoskeletal Indications, Non-Wound This is a NON-coverage policy for all amniotic membrane, amniotic fluid or other placental-derived product injections and/or applications as a means of managing musculoskeletal injuries, joint conditions, and all other conditions not stated below.
This guidance does NOT include discussion on burns, wounds or ophthalmic conditions.
NOTE: For information on stem cell transplantation please see CMS National Coverage Determination 110.23 Stem Cell Transplantation
Introduction
Amniotic and placental-derived products are reported to possess certain beneficial characteristics. These products have been proposed as a source of stem cells. Stem cells, by definition, have the capability to differentiate into any cell of an organism as well as the capability of self-renewal.1 In addition, the extracellular matrix (ECM) of placental and amniotic-based tissues are rich in collagen, glycoproteins, proteoglycans, fibroblasts, as well as many cytokines and growth factors thought to promote healing with a lower risk of low immunologic reaction.
Based on these characteristics, amniotic and placental-derived products are currently being studied and marketed as allografts to serve as:

scaffolds for tissue engineering
membrane covering for certain burns, wounds, and ophthalmic corneal injuries
micronized/particulate products suspended in an aqueous material to be applied topically or injected into joints, tendons, ligaments
applications or injections performed intra-operatively to promote post-operative healing

These amniotic and placental-derived products are further being investigated for a multitude of indications, including but not limited to musculoskeletal conditions involving joint pain and back pain, chronic pain in general, dental conditions, alopecia, wounds, burns, and a plethora of others. In the quest to find alternative treatments for certain musculoskeletal conditions, the emergence of a class of substances being marketed as &ldquo;orthobiologics&rdquo; has become more prevalent in the pharmaceutical market. &ldquo;Orthobiologics&rdquo; are biological products aimed at treating musculoskeletal conditions purported to heal injury/trauma, slow degenerative processes and affect regeneration of tissues.2 The result ideally would be decreased pain and increased function. One such category of orthobiologics involves the incorporation of human amniotic and placental-derived products.
The amniotic and placental-derived products are obtained from the placenta of donors, usually, immediately post C-section at full term and screened for transmittable diseases. These products are made up of varying combinations of amniotic membrane, amniotic fluid, chorionic membrane, umbilical cord, umbilical cord blood, and what is known as Wharton&rsquo;s jelly.3
Definitions:
Musculoskeletal- Refer to the connective tissues including bones, muscles, and their associated tissues such as tendons and ligaments.
The Placenta is a multi-layered circulatory temporary organ that supplies food and oxygen to the fetus during pregnancy.The multiple layers of the placenta include the:

Amnion- the innermost membrane that surrounds the fetus during gestation
Chorion- outermost membrane that surrounds the fetus during gestation

Amniotic fluid is the fluid surrounding the fetus within the amnion.Umbilical cord is the vascular conduit connecting the fetus to the placenta comprised of the umbilical vein, arteries, allantois and yolk sac embedded in Wharton&rsquo;s jelly. Wharton&rsquo;s Jelly is a gelatinous soft connective tissue derived from extra-embryonic mesoderm within the umbilical cord.4
The amniotic membrane itself is divided into three histologic layers:

A single epithelial layer
A thick basement membrane
An avascular stromal (mesenchymal) layer5.6,7,8 

The avascular stromal layer is further divided into three layers:6,7,8

The Compact layer
The middle Fibroblast layer
The Spongy layer

The Spongy Layer, loosely connected to the chorionic membrane, is highly concentrated with proteoglycans and glycoproteins including hyaluronic acid, as well as type I, III, and IV collagen.5,6,8,9
The middle Fibroblast layer is made up of type I, III, V, and VI collagen.6,8,9
The Compact layer that sits adjacent to the basement membrane is composed of collagen Types I, III, V, and VI, along with fibronectin.5,9
The basement membrane anchors the epithelial layer14 and contains collagen Types IV, V and VII, fibronectin, laminin, and hyaluronic acid.6,10
Adjacent to the basement membrane and in immediate contact with amniotic fluid is the single layer of epithelial cells. Amniotic epithelial cells produce type III and IV collagen, glycoproteins such as laminin and fibronectin, which become the basement membrane.5
The amniotic membrane&rsquo;s purpose is to house and physically protect the fetus, but additional functions include regulation of the pH of the amniotic fluid, transportation of water and soluble material between the mother and fetus, and the synthesis of numerous growth factors and cytokines. The amniotic membrane also secretes anti-inflammatory proteins. All of this results in these tissues having anti-inflammatory, anti-microbial, anti-fibroblastic, and non-immunogenic properties.
Amniotic products have been asserted to be a source of stem cells. Both the amniotic epithelial layer (fetal derived cells) and mesenchymal (avascular stromal) layer derived from the embryonic mesoderm contain their respective stem cells that can differentiate into multiple cell lines, including myocytes, osteocytes, and chondrocytes.8,9 Amniotic fluid also is found to contain amniotic mesenchymal stem cells.7
The chorionic membrane adjacent to the mother&rsquo;s endometrium during development of the fetus. Umbilical cord, Wharton&rsquo;s jelly, and umbilical cord blood have also been found to contain mesenchymal stem cells.7,11
Under normal conditions, placental tissues are collected via aseptic technique during cesarean section. Protocols vary as to how the tissues are harvested, prepared, preserved and stored. Testing is also required to ensure these tissues do not carry any communicable diseases transmissible from donor to recipient.
Because the spongy layer loosely connects the amniotic membrane to the chorionic membrane, these two layers are easily separated upon blunt dissection at initial harvesting.10 Other than ease of separation between amniotic and chorionic membranes, the following steps in processing the tissues into the desired form vary, based on the portions of the placental tissues extracted, sterilization processes (if any) undertaken, and method of preservation utilized. Common methods of preservation include cryopreservation, lyophilization (freeze-drying), glycerol-preservation, &gamma; (gamma)-sterilization, low heat dehydration, and vitrification.5,8,9,10
A process called &ldquo;Decellularization&rdquo; using physical, biological, chemical or combination of methods may be used to remove all cellular and nuclear materials while preserving the extracellular matrix components.12 Removal of all cellular components is thought to lessen the possibility of eliciting an immune response.3,10 Different decellularization processes are available. Eventual preparation of sheets, particulate suspensions, liquids, or gels allows the final marketed product.
Depending on the methods utilized, the processing of placental and amniotic-based tissues will affect the viability of cellular components, growth factors, and other valuable properties for which these tissues are promoted. To date, there are significant differences that exist in the processing of different placental and amniotic-based tissue products.3,5 Lack of consistency and standardization within propriety manufacturing (preparation) processes precludes determination and comparison of the final product form, characteristics, properties, and components. Placental-Based Products are not analogous to stem cells as many placental-based products are void of stem cell or living cells after processing.
The Food and Drug Administration (FDA), under Sect. 361 of the Public Health Service Act (regulated by the Centers for Biologics Evaluation and Research CBER, an arm of the FDA) oversees the therapeutic use of ""Human cells or tissue products"" or &ldquo;HCT/P&rdquo;s. Once these types of products are harvested, their processing and handling will determine whether the products fall under Section 361 guidance or default to the more regulated section 351 of the Public Health Service Act and/or the Federal Food, Drug, and Cosmetic Act. The regulatory pathway for pre-market FDA approval of new drugs, devices and/or biological products, requires registration as a New Drug application (NDA), a Premarket Approval (PMA) or other appropriate device premarket clearance such as 510(k),&nbsp;or a (BLA) Biologics License Approval.8,9,13,14
If a human cells or tissue product meets Section 361 FDA requirements, the product will not require FDA pre-market review and approval. To meet &ldquo;Section 361&rdquo; FDA regulatory requirements, the placental/amniotic-based tissue product must meet the following 4 criteria:
The HCT/P is:

Minimally Manipulated
Intended for Homologous Use (as reflected by the labeling, advertising, or other indications of the manufacturer&rsquo;s objective intent)
The manufacture of the HCT/P does not involve the combination of the cells or tissues with another agent, except for water, crystalloids, or a sterilizing, preserving, or storage agent, provided that the addition of water, crystalloids, or the sterilizing, preserving, or storage agent does not raise new clinical safety concerns with respect to the HCT/P
Either:

The HCT/P does not have a systemic effect and is not dependent upon the metabolic activity of living cells for its primary function; or
The HCT/P has a systemic effect or is dependent upon the metabolic activity of living cells for its primary function, and:

Is for autologous use.
Is for allogeneic use in a first-degree or second-degree blood relative.
Is for reproductive use.13





Due to the ongoing development of new products and clinical trials, the field of FDA regulatory requirements is evolving. It is the expectation that the respective Medicare Administrative Contractor will continue to follow any guidance as it is issued by the FDA.
Lack of standard formulation, dose, frequency of administration, and standard of care in treatment with these products further complicates regulation and guidance determinations.
Despite this lack of standardization, numerous amniotic and placental-derived products have been released for use in treatment of musculoskeletal conditions. These conditions include, but are not limited to tendon/ligament injuries, musculoskeletal injuries, cartilage damage, osteoarthritis, or pain related of these conditions as well as adjunctive orthopedic surgical treatments. Due to the lack of component standardization, the remainder of this LCD will use the term amniotic and placental-derived products to mean ANY product derived from ANY combination of amniotic membrane/chorion/placenta/Wharton&rsquo;s jelly/umbilical cord/amniotic fluid/umbilical cord blood.
Although amniotic and placental-derived products are marketed to treat certain musculoskeletal conditions, there is limited available support for safety and efficacy from human clinical trials.&nbsp; "
